{"formatVersion":1,"contentSha256":"dbe484b72e26a0ad889052b75cbbd0268a417e5ed9898274915add9a3c768682","revision":3,"selectedRoom":"intent-room","rooms":[{"roomId":"intent-room","label":"Intent room","pinned":false,"component":{"id":"org.workbench.example.mortgage-ui","version":"0.1.0","sha256":"64987f2704fa0d313ec2529e1e0fd9a0a16b8551cc9e42a352c57f950587cb95"},"ui":{"path":"ui.json","sha256":"b2bfe1b7ed2d83a762ca0bf884b4db6c4cee57af4d6876cf089b487ff428c5c6","schemaSha256":"f183fe5d5566d6420fbf6c6ab052a7aa7dc86e41e694a5371551ef51b55c5380"},"room":{"roomFormatVersion":"0.1","roomId":"intent-room","revision":2,"name":"Intent room","components":[{"instanceId":"component","id":"org.workbench.example.mortgage-ui","version":"0.1.0","sha256":"64987f2704fa0d313ec2529e1e0fd9a0a16b8551cc9e42a352c57f950587cb95"}],"connections":[],"state":{"component.calculate":{"annual_rate_percent":"5","principal":"250000","term_months":300}},"ui":{"definitionRef":"org.workbench.example.mortgage-ui/ui.json"}},"outputs":{"payment":{"monthly_payment":"1461.48"}}}]}