{"formatVersion":1,"revision":1,"selectedRoom":"fixture-room","rooms":[{"roomId":"fixture-room","label":"Mortgage calculator","pinned":true,"component":{"id":"org.workbench.example.mortgage-ui","version":"0.1.0","sha256":"64987f2704fa0d313ec2529e1e0fd9a0a16b8551cc9e42a352c57f950587cb95"},"ui":{"path":"ui.json","sha256":"b2bfe1b7ed2d83a762ca0bf884b4db6c4cee57af4d6876cf089b487ff428c5c6","schemaSha256":"f183fe5d5566d6420fbf6c6ab052a7aa7dc86e41e694a5371551ef51b55c5380"},"room":{"roomFormatVersion":"0.1","roomId":"fixture-room","revision":2,"name":"Mortgage calculator","components":[{"instanceId":"component","id":"org.workbench.example.mortgage-ui","version":"0.1.0","sha256":"64987f2704fa0d313ec2529e1e0fd9a0a16b8551cc9e42a352c57f950587cb95"}],"connections":[],"state":{"component.calculate":{"principal":"250000.00","annual_rate_percent":"5.00","term_months":300}},"ui":{"definitionRef":"org.workbench.example.mortgage-ui/ui.json"}},"outputs":{"payment":{"monthly_payment":"1461.48"}}}],"contentSha256":"d34bc1bb0494c94aca713079d29556a3108177756215f4ebfe0c41851354ec32"}
